{
  "schema_version": 1,
  "id": "codex-deepseek",
  "version": "3.1.33",
  "component_release": "3.48.0",
  "publisher": "cowboy-first-party",
  "kind": "agent_provider",
  "entrypoint": "provider.json",
  "components": [
    {
      "id": "cowboy.plugin-contract",
      "version": "1.10.0"
    },
    {
      "id": "cowboy.plugin-sdk",
      "version": "1.11.1"
    },
    {
      "id": "cowboy.plugin-api",
      "version": "1.1.2"
    },
    {
      "id": "cowboy.provider-sdk",
      "version": "3.1.13"
    },
    {
      "id": "cowboy.provider-ui",
      "version": "3.1.18"
    },
    {
      "id": "cowboy.provider-runtime",
      "version": "1.1.14"
    }
  ]
}
