{
  "schema_version": 1,
  "id": "matrix",
  "version": "1.0.1",
  "component_release": "3.56.0",
  "publisher": "cowboy-first-party",
  "kind": "memory_backend",
  "entrypoint": "contract.json",
  "components": [
    {
      "id": "cowboy.plugin-contract",
      "version": "1.11.0"
    },
    {
      "id": "cowboy.plugin-sdk",
      "version": "1.12.1"
    }
  ]
}
