{
  "schema_version": 1,
  "id": "victoria",
  "version": "1.1.0",
  "component_release": "2.9.0",
  "publisher": "cowboy",
  "kind": "telemetry_backend",
  "entrypoint": "telemetry.json",
  "components": [
    { "id": "cowboy.plugin-contract", "version": "1.8.0" },
    { "id": "cowboy.plugin-sdk", "version": "1.8.0" }
  ]
}
