{
  "schema_version": 1,
  "id": "cloudflare-email",
  "version": "1.0.0",
  "component_release": "2.0.3",
  "publisher": "example-publisher",
  "kind": "authentication_provider",
  "entrypoint": "authentication.json",
  "components": [
    { "id": "cowboy.plugin-contract", "version": "1.2.0" },
    { "id": "cowboy.plugin-sdk", "version": "1.2.0" }
  ]
}
