{
  "schema_version": 1,
  "id": "zed",
  "version": "1.20.7",
  "component_release": "3.53.0",
  "publisher": "cowboy-first-party",
  "kind": "code_intelligence",
  "entrypoint": "contract.json",
  "components": [
    {
      "id": "cowboy.plugin-contract",
      "version": "1.11.0"
    },
    {
      "id": "cowboy.plugin-sdk",
      "version": "1.12.0"
    },
    {
      "id": "cowboy.code-intelligence",
      "version": "1.2.0"
    }
  ]
}
