{
  "schema_version": 1,
  "id": "github",
  "version": "0.2.3",
  "component_release": "3.53.0",
  "publisher": "cowboy-first-party",
  "kind": "workspace_extension",
  "entrypoint": "contract.json",
  "components": [
    {
      "id": "cowboy.plugin-contract",
      "version": "1.11.0"
    },
    {
      "id": "cowboy.plugin-sdk",
      "version": "1.12.0"
    }
  ]
}
